Name,Inventors,Assignee,Patent title,URLs,Item type,Topic area,Molecules,Keywords (GFI),Technology sector,Common Name,Abstract,Keywords,Resource,Species,Notes (public),Publication year,Date published,Issuing authority,Patent number,Date filed,Type of patent,Issuing office full name,Application number,Created,Last Modified
Van Eelen_1999,"Van Eelen WF,Van Kooten WJ,Westerhof W",Willem Frederik Van Eelen,Industrial scale production of meat from in vitro cell cultures,https://patentimages.storage.googleapis.com/2b/b9/37/5a8bfe4d84fce7/WO1999031222A1.pdf; https://patents.google.com/patent/WO1999031222A1/en,Patent,"Cultivated,Meat",,,,,"A process for production of a meat product said process comprising the culturing in vitro of animal cells in medium free of hazardous substances for humans on an industrial scale thereby providing three dimensional animal muscle tissue suited for human and/or animal consumption, optionally followed by further processing steps of the cell culture to a finished food product analogous to known processes for meat comprising food products without requiring deboning, removal of offal and/or tendon and/or gristle and/or fat, preferably said meat product comprising solidified cell tissue, said cells being selected from muscle cells, somite cells and stem cells. A meat product, consisting of in vitro produced animal cells in a three dimensional form i.e. comprising multiple cell layers of animal cells in three dimensions, said meat product being free of fat, tendon, bone and gristle, said cells being selected from muscle cells, stem cells or somite cells.",,Cultivated Meat Library,,,1999,1999-06-24,WIPO,1999031222:A1,1997-12-18,World Patent,World Intellectual Property Organization,PC:T/NL1997/000710,2021-11-12,2021-11-23
Vein_2005,Vein J,Jon Vein,Method for producing tissue engineered meat for consumption,https://patentimages.storage.googleapis.com/d3/45/32/ca259d182d2acf/US20050010965A1.pdf; https://patents.google.com/patent/US20050010965A1/en,Patent,"Cultivated,Meat",,,,,"A non-human tissue engineered meat product and a method for producing such meat product are disclosed. The meat product comprises muscle cells that are grown ex vivo and is used for food consumption. The muscle cells may be grown and attached to a support structure and may be derived from any non-human cells. The meat product may also comprise other cells such as fat cells or cartilage cells, or both, that are grown ex vivo together with the muscle cells.",,Cultivated Meat Library,,,2005,2005-01-13,USPTO,20050010965:A1,2001-11-16,US Patent,United States Patent and Trademark Office,US:09/991544,2021-07-23,2021-11-02
Van Eelen_2007,Van Eelen WF,Willem Frederik Van Eelen,Industrial production of meat using cell culture methods,https://patentimages.storage.googleapis.com/00/69/34/1a632a16cfa069/US7270829B2.pdf; https://patents.google.com/patent/US7270829B2/en,Patent,"Cultivated,Meat",,,,,A meat product containing in vitro produced animal cells in a three dimensional form and a method for producing the meat product.,,Cultivated Meat Library,,,2007,2007-09-18,USPTO,7270829,2005-05-09,US Patent,United States Patent and Trademark Office,US:11/124372,2021-07-23,2021-11-02
Forgacs_2014,"Forgacs G,Marga F,Jakab KR",University of Missouri System,Engineered comestible meat,https://patentimages.storage.googleapis.com/ff/3a/ad/0d50903cf2c696/US20140093618A1.pdf; https://patents.google.com/patent/US20140093618A1/en,Patent,"Cultivated,Meat",,,,,"Provided are engineered meat products formed as a plurality of at least partially fused layers, wherein each layer comprises at least partially fused multicellular bodies comprising non-human myocytes and wherein the engineered meat is comestible. Also provided are multicellular bodies comprising a plurality of non-human myocytes that are adhered and/or cohered to one another; wherein the multicellular bodies are arranged adjacently on a nutrient-permeable support substrate and maintained in culture to allow the multicellular bodies to at least partially fuse to form a substantially planar layer for use in formation of engineered meat. Further described herein are methods of forming engineered meat utilizing said layers.",,Cultivated Meat Library,,,2014,2014-04-03,USPTO,20140093618:A1,2013-11-27,US Patent,United States Patent and Trademark Office,US:14/092801,2021-11-12,2021-11-23
Hasson_2015,"Hasson A,Yirme G,Lavon N,Geffen-Shalev C,Molakandov K",Kadimastem Ltd,Methods for large scale generation of stem cells,https://patentimages.storage.googleapis.com/bd/b6/79/fd44efa8a5f854/WO2015008275A1.pdf; https://patents.google.com/patent/WO2015008275A1/en,Patent,,,,,,"The present invention discloses methods for large scale generation of stem cells. The present invention is directed to compositions and methods for cultivating stem cells, in large-scale culture.",,Cultivated Meat Library,,,2015,2015-01-22,WIPO,2015008275:A1,2014-07-10,World Patent,World Intellectual Property Organization,PC:T/IL2014/050622,2021-07-23,2021-11-02
Genovese_2016,"Genovese NJ,Michael Roberts R,BP",Memphis Meats Inc,Method for scalable skeletal muscle lineage specification and cultivation,https://patentimages.storage.googleapis.com/a3/d7/7d/b68da87711e8e9/US20160227830A1.pdf; https://patents.google.com/patent/US20160227830A1/en,Patent,"Cultivated,Meat",,,,,"The present disclosure relates to methods for enhancing cultured meat production, such as livestock-autonomous meat production. In certain aspects, the meat is any metazoan tissue or cell-derived comestible product intended for use as a comestible food or nutritional component by humans, companion animals, domesticated or captive animals whose carcasses are intended for comestible use, service animals, conserved animal species, animals used for experimental purposes, or cell cultures.",,Cultivated Meat Library,,,2016,2016-08-11,USPTO,20160227830:A1,2016-04-20,US Patent,United States Patent and Trademark Office,US:15/134252,2021-07-23,2021-11-02
Marga_2016,Marga FS,MODERN MEADOW Inc,Dried food products formed from cultured muscle cells,https://patentimages.storage.googleapis.com/6c/ef/3b/ea032549e52596/US20160227831A1.pdf; https://patents.google.com/patent/US20160227831A1/en,Patent,"Cultivated,Plant-based,Meat",,,,,"Dehydrated, edible, high-protein food products formed of cultured muscle cells that are combined (e.g., mixed) with a hydrogel (e.g., a plant-derived polysaccharide) are described. These food products may be formed into a chip (e.g., snack chip), that has a protein content of greater than 50%. One or more flavorants may also be included.",,Cultivated Meat Library,,,2016,2016-08-11,USPTO,20160227831:A1,2016-04-07,US Patent,United States Patent and Trademark Office,US:15/093618,2021-07-23,2021-11-02
Genovese_2017b,"Genovese N,Desmet DN,Schulze E","Memphis Meats, Inc.",Methods for extending the replicative capacity of somatic cells during an ex vivo cultivation process,https://patentimages.storage.googleapis.com/e7/9b/35/7f2b2deb7d0eee/WO2017124100A1.pdf; https://patents.google.com/patent/WO2017124100A1/en,Patent,"Cultivated,Meat",Telomerase,,Cell line development,"Cow, Chicken","A product and process for extending the replicative capacity of metazoan somatic cells using targeted genetic amendments to abrogate inhibition of cell-cycle progression during replicative senescence and derive clonal cell lines for scalable applications and industrial production of metazoan cell biomass. An insertion or deletion mutation using guide RNAs targeting the first exon of the transcript encoding each protein is created using CRISPR/Cas9. Targeted amendments result in inactivation of p15 and p16 proteins which increases the proliferative capacity of the modified cell populations relative to their unaltered parental populations. Combining these amendments with ancillary telomerase activity from a genetic construct directing expression of a telomerase protein homolog from a TERT gene, increases the replicative capacity of the modified cell populations indefinitely. One application is to manufacture skeletal muscle for dietary consumption using cells from the poultry species Gallus gallus ; another is from the livestock species Bos taurus.",,Cultivated Meat Library,"Bos taurus,Gallus gallus",,2017,2017-07-20,WIPO,2017124100:A1,2017-01-17,World Patent,World Intellectual Property Organization,PC:T/US2017/013782,2021-07-23,2022-08-26
Hanyu_2017,"Hanyu Y,Kawashima I",,"Growth induction system, growth induction control device, growth induction control method, and growth induction control program",https://patents.google.com/patent/JP6111510B1/en,Patent,"Cultivated,Meat",,,"Cell culture media,Bioprocess design",,"In order to induce growth while suppressing the cost of adding cytokines at each growth stage, the first culture tank for perfusing the culture medium to the growth induction target derived from the living body, the second for perfusing the culture medium to the secretory secreting cytokine In a growth induction system comprising a culture vessel and a growth induction control device comprising a detection unit, a storage unit, and a control unit, a growth induction protocol that defines a growth induction procedure is stored, and in the control unit, a detection unit Based on the growth induction protocol, the flow rate of supplying the culture medium containing the cytokine secreted by the secretory body to the growth induction target is controlled based on the growth induction protocol. To do. [Selection] Figure 1",,Cultivated Meat Library,,,2017,2017-04-12,,,,Patent,,,2021-11-12,2021-11-23
Marga_2017,"Marga FS,Purcell BP,Forgacs G,Forgacs A","Modern Meadow, Inc. (Brooklyn, NY, US)",Edible and animal-product-free microcarriers for engineered meat,http://www.freepatentsonline.com/9752122.html,Patent,"Cultivated,Meat",Pectin,,Scaffolding,,"Edible microcarriers, including microcarrier beads, microspheres and microsponges, appropriate for use in a bioreactor to culture cells that may be used to form a comestible engineered meat product. For example, the edible microcarriers described herein may include porous microcarriers that may be used to grow cells (e.g., smooth muscle cells) and may be included with the cells in the final engineered meat product, without requiring modification or removal of the cells from the microcarriers. In a particular example, the edible microcarriers may be formed of cross-linked pectin, such as pectin-thiopropionylamide (PTP), and RGD-containing polypeptide, such as thiolated cardosin A. Methods of forming edible microcarriers, methods of using the edible microcarriers to make engineered meat, and engineered meat including the edible microcarriers are also described herein.",Microcarriers,"Cultivated Meat Library,Deep dive: Cultivated meat scaffolding part A",,,2017,2017-09-05,USPTO,,2014-09-15,US Patent,United States Patent and Trademark Office,,2021-07-23,2023-01-30
Genovese_2018,"Genovese NJ,Firpo MT,Dambournet D","Memphis Meats, Inc.",Compositions and methods for increasing the culture density of a cellular biomass within a cultivation infrastructure,https://patentimages.storage.googleapis.com/ae/46/f9/4b0f92532c1dab/WO2018208628A1.pdf; https://patents.google.com/patent/WO2018208628A1/en,Patent,"Cultivated,Meat",,,,,"Provided herein are methods to increase the culture density and/or thickness of a cellular biomass in a cultivation infrastructure, to improve the culture of cells in the absence of serum in a cultivation infrastructure, and to promote anchorage-independent growth of a cellular biomass in a cultivation infrastructure. The methods comprise inhibiting the HIPPO signaling pathway, for example, by activating YAP1, activating TAZ, and/or inhibiting MOB1, LATS1 kinase, LATS2 kinase, WW45, MST1 kinase, and/or MST2 kinase in the cellular biomass. In some embodiments, the cellular biomass is harvested from the cultivation infrastructure for the formulation of cell-based food products or ingredients, such as animal meat manufactured from cells in an ex vivo process or for therapeutic applications such as organ or tissue transplantation or grafting.",,Cultivated Meat Library,,,2018,2018-11-15,WIPO,2018208628:A1,2018-05-05,World Patent,World Intellectual Property Organization,PC:T/US2018/031276,2021-07-23,2021-11-02
Ho_2018,"Ho CM,Zhao Y,Liao JC",University of California,Fatty acid production in cell-free systems,https://patentimages.storage.googleapis.com/e5/b2/6f/225150c9980d31/US10155968.pdf; https://patents.google.com/patent/US10155968,Patent,,Fat or fatty acid,Algae,,,"The present invention is directed to methods, compositions, and systems for the production of fatty acids (FAs). Specifically, the disclosed methods, compositions, and systems incorporate algal cell lysates, providing a cell-free environment that generates high levels of FAs for extended periods of time with the addition of liquid media and a carbon source.",,Cultivated Meat Library,,,2018,2018-12-18,USPTO,10155968,2014-07-29,US Patent,United States Patent and Trademark Office,US:14/909016,2021-11-12,2021-11-23
Nahmias_2018,Nahmias Y,Yissum Research Development Company Of The Hebrew University Of Jerusalem Ltd.,Systems and methods for growing cells in vitro,https://patentimages.storage.googleapis.com/ac/b7/dc/a93500908f9390/WO2018011805A9.pdf; https://patents.google.com/patent/WO2018011805A9/en,Patent,"Cultivated,Meat",,,Bioprocess design,,"A system for growing cells comprising a bioreactor chamber for growing the cells, a delivery system delivering a perfusion solution to the bioreactor chamber for perfusion of the perfusion solution through the cells, a dialysis system having a dialyzer, a dialysate for performing a dialysis and a filter for reducing ammonia content in said dialysate, and a controller that circulates the perfusion solution through the dialyzer and the dialysate through the filter.",,Cultivated Meat Library,,,2018,2018-05-24,WIPO,2018011805:A9,2017-07-11,World Patent,World Intellectual Property Organization,PC:T/IL2017/050790,2021-07-23,2021-11-02
Savir_2018,"Savir I,Friedman S,Barak K",Supermeat The Essence Of Meat Ltd.,Cultured meat-containing hybrid food,https://patentimages.storage.googleapis.com/2f/04/15/95c5c8defdca43/WO2018189738A1.pdf; https://patents.google.com/patent/WO2018189738A1/en,Patent,"Cultivated,Plant-based,Meat",,,,,"A method of producing a hybrid foodstuff is provided. The method comprises combining a plant-originated substance with an amount of cultured animal cells so as to enhance a meat organoleptic and/or meat nutritional property in the hybrid foodstuff, wherein the animal cells do not form a tissue, and wherein the amount is below 30 % (w/w) of the hybrid foodstuff.",,Cultivated Meat Library,,,2018,2018-10-18,WIPO,2018189738:A1,2018-04-04,World Patent,World Intellectual Property Organization,PC:T/IL2018/050398,2021-07-23,2021-11-02
Vallier_2018,"Vallier L,Kotter M,Pawlowski M,Bertero A,Ortmann D",Cambridge Enterprise Limited,Controllable transcription,https://patentimages.storage.googleapis.com/69/09/82/d0ab904e7deb91/WO2018096343A1.pdf; https://patents.google.com/patent/WO2018096343A1/en,Patent,,,,Cell line development,,"The present invention relates to a stable method for introducing at least one inducible cassette into a cell, and permitting controllable transcription from within that inducible cassette. The method may be used for any cell type, from any eukaryotic organism, but has a particular application in the introduction of inducible cassettes into pluripotent stem cells, such as animal or human pluripotent stem cells (hPSCs). The inducible cassette is controllably inserted in such a way to ensure that the genetic material it contains is not silenced or subject to negative influences from the insertion site, and transcription of the genetic material is controlled.",,Cultivated Meat Library,,,2018,2018-05-31,WIPO,2018096343:A1,2017-11-24,World Patent,World Intellectual Property Organization,PC:T/GB2017/053531,2021-07-23,2021-11-02
羽生 雄毅_2018,"羽生 雄毅,川島 一公",インテグリカルチャー株式会社,"Growth guidance system, growth induction controller, growth guidance control method, and the growth induction control program",https://patentimages.storage.googleapis.com/d7/5f/9e/5e304e4a3511e7/JPWO2017191691A1.pdf; https://patents.google.com/patent/JPWO2017191691A1/en,Patent,,,,,,"To induce growth suppressing the cost for each growth stage addition of cytokines, second perfused first culture tank for perfusion of the culture solution in growth induction subject-derived biological, the culture solution secretion body to secrete cytokines fermentor, and the growth induction control device and a control unit and the detection unit and the storage unit, in the growth induction system having a, stores the growth induction protocol that defines the growth induction procedure, the control unit, the detection unit detecting the growth conditions of growth induced subject via, on the basis of the growth induction protocol in response to the growth conditions of the growth-induced target, controls the flow rate supplied to the culture fluid containing secreted body secreted cytokine growth inducing target to. .FIELD 1",,"Cultivated Meat Library,Deep dive: Cultivated meat cell culture media part B",,,2018,2018-05-31,,JP:WO2017191691:A1,2016-06-13,Patent,,JP:2016067599A,2021-07-23,2021-07-30
Ben-Arye_2019a,"Ben-Arye T,Levenberg S",Technion Research & Development Foundation Limited,Cultured meat compositions,https://patentimages.storage.googleapis.com/d3/e2/38/7cc42aa5f271b5/WO2019016795A1.pdf; https://patents.google.com/patent/WO2019016795A1/en,Patent,"Cultivated,Meat",,"Satellite cell or myoblast,Vascular cell",Scaffolding,Cow,"The invention is directed to a method for producing an edible composition, comprising incubating a three-dimensional porous scaffold and a plurality of cell types comprising: myoblasts or progenitor cells thereof, at least one type of extracellular (ECM)-secreting cell and endothelial cells or progenitor cells thereof, and inducing myoblasts differentiation into myotubes.",,Cultivated Meat Library,Bos taurus,,2019,2019-01-24,WIPO,2019016795:A1,2018-07-15,World Patent,World Intellectual Property Organization,PC:T/IL2018/050776,2021-07-23,2023-02-10
Breemhaar_2019,"Breemhaar JJ,Post M",Mosa Meat BV,Apparatus and process for production of tissue from cells,https://patentimages.storage.googleapis.com/c7/77/25/4ee847c663a877/US20190338232A1.pdf; https://patents.google.com/patent/US20190338232A1/en,Patent,,,,,,"Disclosed is an apparatus for the production of tissue from cells. The apparatus comprises an elongate body having at least one circumferential groove and being operable to extend, by close-fitting relationship, centrally through at least one trough. The troughs are extending in a closed path, such that the at least one of the circumferential grooves open into an inner edge of a trough. Also disclosed is a process for production of tissue from cells, via a transitioning intermediate which transitions from the cells into the tissue.",,"Cultivated Meat Library,Deep dive: Cultivated meat scaffolding part A",,,2019,2019-11-07,USPTO,20190338232:A1,2018-06-13,US Patent,United States Patent and Trademark Office,US:16/007943,2021-07-23,2021-07-30
Forgacs_2019,"Forgacs G,Gupta N","Fork & Goode, Inc",LARGE SCALE CELL CULTURE SYSTEM FOR MAKING MEAT AND ASSOCIATED PRODUCTS,http://www.freepatentsonline.com/y2019/0376026.html,Patent,"Cultivated,Meat",,,,,Provided is a large-scale cell culture system for producing products without harming animals. Also provided is a method for making meat products using this cell culture system. Further provided is a m,,"Cultivated Meat Library,Deep dive: Cultivated meat cell culture media part B",,,2019,2019-12-12,USPTO,20190376026,2018-08-24,US Patent,United States Patent and Trademark Office,16/112171,2021-07-23,2021-11-23
Genovese_2019,"Genovese NJ,Schulze EN,Desmet DN","Memphis Meats, Inc.",Compositions and methods for increasing the efficiency of cell cultures used for food production,https://patentimages.storage.googleapis.com/cd/16/a8/9323d5188e5ce5/WO2019014652A1.pdf; https://patents.google.com/patent/WO2019014652A1/en,Patent,"Cultivated,Meat",,,Cell line development,,"Provided herein are compositions and methods to make and use engineered cells, for the purpose of increasing the cell density of a culture comprising metazoan cells and for the production of a cultured edible product.",,"Cultivated Meat Library,Deep dive: Cultivated meat bioprocess design",,,2019,2019-01-17,WIPO,2019014652:A1,2018-07-13,World Patent,World Intellectual Property Organization,PC:T/US2018/042187,2021-07-23,2021-11-23
Bayer_2020,"Bayer E,McIntyre G,Mueller P,O'Brien M,Schaak D,Winiski J,Carlton A",Ecovative Design LLC,Methods of Generating Mycelial Scaffolds and Applications Thereof,https://patentimages.storage.googleapis.com/a3/55/f7/bf17904e89a533/US20200157506A1.pdf; https://patents.google.com/patent/US20200157506A1/en,Patent,"Cultivated,Meat",,,Scaffolding,,"Several methods are described for generating mycelial scaffolds for use several technologies. In one embodiment, a mycelial scaffold is generated using a perfusion bioreactor system for cell-based meat technologies. In another embodiment, a mycelial scaffold is prepared for biomedical applications. The mycelial scaffolds may be generated from a liquid medium or from a solid substrate.",,"Cultivated Meat Library,Deep dive: Cultivated meat scaffolding part A",,,2020,2020-05-21,USPTO,20200157506:A1,2019-11-19,US Patent,United States Patent and Trademark Office,US:16/688699,2021-07-23,2023-01-30
Elfenbein_2020a,"Elfenbein A,Kolbeck JL","WILD TYPE, INC.",EX VIVO MEAT PRODUCTION,http://www.freepatentsonline.com/y2020/0140821.html; https://patents.google.com/patent/WO2018227016A1/en,Patent,"Cultivated,Seafood,Meat",,,,,"Systems and methods for producing cell cultured food products. The cultured food products include sushi-grade fish meat, fish surimi, foie gras, and other food types. Various cell types are utilized to produce the food products and can include muscle, fat, and/or liver cells. The cultured food products are grown in pathogen-free culture conditions without exposure to toxins and other undesirable chemicals.",,Cultivated Meat Library,,,2020,2020-05-07,USPTO,20200140821,2018-06-07,US Patent,United States Patent and Trademark Office,16/620326,2021-07-23,2022-08-26
Johnson_2020,"Johnson JK,Ohst D","NANOFIBER SOLUTIONS, LLC",ELECTROSPUN POLYMER FIBERS FOR CULTURED MEAT PRODUCTION,http://www.freepatentsonline.com/y2020/0245658.html,Patent,"Cultivated,Meat",,,Scaffolding,,"A cultured meat product may comprise a scaffold comprising an electro spun polymer fiber, and a population of cells. The cultured meat product may have a thickness from about 100 μm to about 500 mm. A",,Cultivated Meat Library,,,2020,2020-08-06,USPTO,20200245658,2020-02-03,US Patent,United States Patent and Trademark Office,16/780187,2021-07-23,2021-11-12
Nahmias_2020,Nahmias Y,Yissum Research Development Company of Hebrew University of Jerusalem,Systems and methods for growing cells in vitro,https://patents.google.com/patent/US20200080050A1/en,Patent,"Cultivated,Meat",,,Bioprocess design,,"A system for growing cells comprising a bioreactor chamber for growing the cells , a delivery system delivering a perfu sion solution to the bioreactor chamber for perfusion of the perfusion solution through the cells , a dialysis system having a dialyzer , a dialysate for performing a dialysis and a filter for reducing ammonia content in said dialysate , and a controller that circulates the perfusion solution through the dialyzer and the dialysate through the filter .",,Cultivated Meat Library,,,2020,2020,,"16/316,667",2016,Patent,,,2021-11-12,2021-11-23
Maiorella_2021,Maiorella BL,,"Structured ""meat"" processes and products from cells grown in suspension culture",https://techtransfer.universityofcalifornia.edu/ncd/32201.html,Patent,"Cultivated,Meat",,,,,,,Cultivated Meat Library,,,2021,,,,,Patent,,,2021-07-23,2021-11-01
Sriram_2020,"Sriram S,Ling KY",Shiok Meats Pte. Ltd.,Isolation and cultivation of muscle and fat cells from crustaceans,https://patentimages.storage.googleapis.com/32/00/de/4bfc77aeefefcf/WO2020149791A1.pdf; https://patents.google.com/patent/WO2020149791A1/en,Patent,"Cultivated,Seafood",,,,,"The present disclosure is directed to methods for the formation and production of renewable muscle and/or fat primary cell lines, immortalized cell lines, and stem cell lines from shrimp, prawn, crab, crayfish, and/or lobster species and the cell lines themselves as well as human and animal consumable meat products produced therefrom.",,Cultivated Meat Library,,,2020,2020-07-23,WIPO,2020149791:A1,2020-01-13,World Patent,World Intellectual Property Organization,PC:T/SG2020/050016,2022-01-06,2023-02-02
