Tsuruwaka_2015,"Tsuruwaka Y,Ogawa T,Hatada Y",Japan Agency for Marine Earth Science and Technology,Cell line derived from thread-sail filefish (stephanolepis cirrhifer),https://patentimages.storage.googleapis.com/72/20/52/7a46fe23a8ce29/US20150175958A1.pdf; https://patents.google.com/patent/US20150175958A1/en,Patent,,,,Cell line development,,"The first object of the present invention is to provide an immortalized cell line derived from a thread-sail filefish. The first object of the present invention can be solved by a cell line or a passage strain thereof derived from a living body part of a fish of the family Monacanthidae, wherein the cell line or the passage strain thereof is capable of being subcultured substantially without limitations. The second object of the present invention is to provide a pluripotent stem cell derived from a thread-sail filefish. The second object of the present invention can be solved by a cell line or a passage strain thereof derived from a living body part of a fish of the family Monacanthidae, wherein the cell line or the passage strain thereof is positive for at least a cell marker selected from a group consisting of TRA-1-60, OCT4 and SSEA-3.",,"Cultivated Meat Library,PISCES/ATLAS",,,2015,2015-06-25,USPTO,20150175958:A1,2013-07-30,US Patent,United States Patent and Trademark Office,US:14/418781,2022-04-27,2022-04-27
Arin_2021,"Arin D,Spaans S",Mosa Meat B.V.,Hydrogels for cultured meat production,https://patentimages.storage.googleapis.com/f9/dc/7c/bd4001db37d2a1/WO2021158105A1.pdf; https://patents.google.com/patent/WO2021158105A1/en?oq=WO2021158105A1,Patent,"Meat,Cultivated",,,,,"The invention is directed to a modified polysaccharide hydrogel, comprising a low molecular weight alginate with a specific M/G ratio. The modified polysaccharide is modified with a specific peptide, preferably comprising a cell-adhesion peptide. The modified polysaccharide hydrogel may be used as a hydrogel for the growth of cultured meat preferably as a sacrificial biopolymer.",,Cultivated Meat Library,,,2021,8/12/21,WIPO,2021158105:A1,2/3/21,World Patent,World Intellectual Property Organization,PC:T/NL2021/050068,2022-08-26,2023-02-02
Nahmias_2021,"Nahmias Y,Wissotsky G",Yissum Research Development Company Of The Hebrew University Of Jerusalem Ltd.,Methods and devices for filtering cell culture media,https://patentimages.storage.googleapis.com/1b/88/13/b0a3c72861d82b/WO2021152536A1.pdf; https://patents.google.com/patent/WO2021152536A1/en,Patent,"Meat,Cultivated",,,,,"The present disclosure provides, in part, a receptacle for filtering a liquid. The receptacle comprises a plurality of hollow fibers extending the length of the receptacle and at least one solid absorbent material occupying a space between the plurality of hollow fibers. Each hollow fiber comprises at least one opening and a lumen defined by the walls thereof, allowing the liquid to flow through. The hollow fiber walls have a porosity profile selective to passage of waste materials contained in the liquid from the lumen to the solid absorbent material(s), thereby filtering the liquid. Also provided is a system as well as a method for filtering and recycling a cell culture medium.",,Cultivated Meat Library,,,2021,8/5/21,WIPO,2021152536:A1,1/29/21,World Patent,World Intellectual Property Organization,PC:T/IB2021/050728,2022-08-26,2023-02-02
Tandikul_2022,"Tandikul N,Genovese NJ",Upside Foods Inc,Systems and methods for cultivating tissue on porous substrates,https://patentimages.storage.googleapis.com/e3/64/2f/8fa158055ee5e0/US20220195358A1.pdf; https://patents.google.com/patent/US20220195358A1/en?oq=US20220195358,Patent,"Meat,Cultivated",,,,,"Described herein are novel systems and methods for biomanufacturing, such as tissue cultivation. In some variations the systems and methods may comprise at least one porous substrate.",,Cultivated Meat Library,,,2022,6/23/22,USPTO,20220195358:A1,12/22/20,US Patent,United States Patent and Trademark Office,US:17/131483,2022-08-26,2023-02-02
Genovese_2022,Genovese NJ,Upside Foods Inc,Fluid conduit with radial expansion of fluid flow,https://patentimages.storage.googleapis.com/cb/f8/b2/ca5f7ab760d792/US20220195368A1.pdf; https://patents.google.com/patent/US20220195368A1/en?oq=US20220195368,Patent,"Meat,Cultivated",,,,,"Disclosed herein are systems, devices, and methods for flowing fluid for radially expanded particle distribution within a laminar flow. In some variations, a system for cultivating tissue may comprise a bioreactor comprising an inlet, a substrate arranged in the bioreactor, and a diffusion module configured to transfer fluid from the inlet to the substrate. The diffusion module may comprise a porous material having at least one tortuous conduit extending between a first surface of the porous material and a second surface of the porous material.",,Cultivated Meat Library,,,2022,6/23/22,USPTO,20220195368:A1,12/21/20,US Patent,United States Patent and Trademark Office,US:17/129662,2022-08-26,2023-02-02
Cruz_2022,"Cruz H,Flack JE,Furquim C,Klevernic I,Melzener L,Messmer T,Van Essen A",Mosa Meat B.V.,Serum-free medium for differentiation of a progenitor cell,https://patentimages.storage.googleapis.com/f6/5f/ab/e1d062ab7b969b/WO2022114955A1.pdf; https://patents.google.com/patent/WO2022114955A1/en?oq=WO2022114955A1,Patent,"Meat,Cultivated",,,,,"The invention relates inter alia to a method for differentiating a muscle progenitor cell, comprising the step of: - culturing a muscle progenitor cell in a serum-free medium for differentiating a muscle progenitor cell, wherein said serum-free medium comprises - at least one differentiation inducer selected from the group consisting of a lysophosphatidic acid receptor 1 (LPAR1) agonist, a lysophosphatidic acid receptor 3 (LPAR3) agonist, an oxytocin receptor (OXTR) agonist, a glucagon receptor (GCGR) agonist, a lactate and a Notch signaling pathway inhibitor.",,Cultivated Meat Library,,,2022,6/2/22,WIPO,2022114955:A1,11/25/21,World Patent,World Intellectual Property Organization,PC:T/NL2021/050718,2022-08-26,2023-02-02
Juarez_2022,Juarez MV,Biotech Foods SL,Bioreactor and method for the production of adherent cell cultures employing said bioreactor,https://patentimages.storage.googleapis.com/6f/34/9f/b859709ddc3c03/US20220177823A1.pdf; https://patents.google.com/patent/US20220177823A1/en?oq=US20220177823A1,Patent,"Meat,Cultivated",,,,,"Bioreactor and production process of adherent cell cultures that uses the bioreactor. The bioreactor includes a recipient with a cover, and further includes internally a bracket from which protrudes at least one tray that supports a three-dimensional polymer-based element mounted on it, such that when the bioreactor is filled with a culture medium the at least one tray and the three-dimensional polymer-based element are surrounded by the culture medium.The process includes the following steps:the bracket, with the at least one tray of the bioreactor, with a three-dimensional polymer-based element is immersed in the culture medium,cells that are desired to be planted on the three-dimensional polymer-based element are inoculated from outside the bioreactor, andthe culture is left in the bioreactor so that the cellular proliferation is produced.",,Cultivated Meat Library,,,2022,6/9/22,USPTO,20220177823:A1,1/4/19,US Patent,United States Patent and Trademark Office,US:17/420274,2022-08-26,2023-02-02
Lavon_2022c,"Lavon N,Levanon SS,Nadav TAL",Aleph Farms Ltd.,A multi-scaffold system for large scale cultivation of cells,https://patentimages.storage.googleapis.com/af/99/6f/c1f5e2180392ed/WO2022097139A1.pdf; https://patents.google.com/patent/WO2022097139A1/en?oq=WO2022097139A1,Patent,"Meat,Cultivated",,,,,"The present invention is in the field of large-scale production of cultured cells, providing systems comprising a plurality of scaffolds arranged optionally in a multi-layer configuration and methods of use thereof for production of cells and/or tissue cultures for a variety of uses, including the production of cultured food products, particularly cultured meat.",,Cultivated Meat Library,,,2022,5/12/22,WIPO,2022097139:A1,11/3/21,World Patent,World Intellectual Property Organization,PC:T/IL2021/051302,2022-08-26,2023-02-02
Weissenbach_2022a,"Weissenbach JL,Sylvia R,von der Brelie A,Brandl M,Fesenfeld M",Merck Patent Gmbh,Process system for bioreactor-based clean meat production,https://patentimages.storage.googleapis.com/c6/0c/6c/cd771907717afc/WO2022038241A1.pdf; https://patents.google.com/patent/WO2022038241A1/en?oq=WO2022038241A1,Patent,"Meat,Cultivated",,,,,The present invention is for a closed environment process for the growth and differentiation of cells and the culturing of cells to confluency for the production of tissue. The tissue may be a clean meat product.,,Cultivated Meat Library,,,2022,2/24/22,WIPO,2022038241:A1,8/19/21,World Patent,World Intellectual Property Organization,PC:T/EP2021/073079,2022-08-26,2023-02-02
Weissenbach_2022b,"Weissenbach JL,Sylvia R,von der Brelie A,Brandl M,Fesenfeld M",Merck Patent Gmbh,Consumable tissue-like structure generated with muscle cells grown on edible hollow fibers,https://patentimages.storage.googleapis.com/22/10/eb/41f76296c5c918/WO2022038240A2.pdf; https://patents.google.com/patent/WO2022038240A2/en?oq=WO2022038240A2,Patent,"Meat,Cultivated",,,,,"The present invention is directed toward edible hollow fibers and cartridges and bioreactors comprising the hollow fibers of the present invention, as well as, methods of production of structured clean meat products produced with the hollow fibers, cartridges and bioreactors of the present invention and the structured clean meat products produced by said methods. The macroscopic structure of structured clean meat grown on edible hollow fibers will result in a unique final structure. This final structure will contain a finite amount of fibers per unit area; with meat on the outside of the fibers.",,Cultivated Meat Library,,,2022,2/24/22,WIPO,2022038240:A2,8/19/21,World Patent,World Intellectual Property Organization,PC:T/EP2021/073078,2022-08-26,2023-02-02
Mueller-Auffermann_2022,Mueller-Auffermann K,Upside Foods Inc,Filter cake-based systems and methods for the cultivation of cells and cell biomass,https://patentimages.storage.googleapis.com/26/02/c2/6c4925d8882757/US11319520.pdf; https://patents.google.com/patent/US11319520B1/en?oq=US11319520,Patent,"Meat,Cultivated",,,,,"Provided herein are filter cake-based systems and methods for cultivating cells and cell biomass therefrom. Provided herein is a system for cultivating cells and cell biomass comprising a filter chamber comprising at least one inlet and at least one outlet, at least one filter support located within the filter chamber, and a filter cake located on the filter support, wherein the filter cake comprises at least one filter aid and a plurality of cells. Provided herein is a method for optimizing the cultivation of cells and cell biomass, comprising providing a filter support, adding at least one filter aid to the filter support, adding a plurality of cells to the filter aid, wherein the cells and the filter aid together comprise a filter cake, growing the cells into a cell biomass in the filter cake, wherein the filter cake is at least partially compressible.",,Cultivated Meat Library,,,2022,5/3/22,USPTO,11319520,9/21/21,US Patent,United States Patent and Trademark Office,US:17/481176,2022-08-26,2023-02-02
Lavon_2022a,"Lavon N,Molotski N,Zehorai E,Glick Y,Fireberg KT",Aleph Farms Ltd.,"Cell-free animal collagen, methods of production and uses thereof",https://patentimages.storage.googleapis.com/fd/29/67/f428d994f71f7b/WO2022043994A1.pdf; https://patents.google.com/patent/WO2022043994A1/en?oq=WO2022043994A1,Patent,"Meat,Cultivated",,,,,"The present invention relates to the field of use of animal cells for producing products containing animal-derived materials in a sustainable manner, preserving natural resources and promoting animal welfare, particularly for production of cell-free collagen and use thereof for forming textile, particularly leather-like textile, food products, particularly cultured meat, cosmetic products, and medical uses.",,Cultivated Meat Library,,,2022,3/3/22,WIPO,2022043994:A1,8/22/21,World Patent,World Intellectual Property Organization,PC:T/IL2021/051026,2022-08-26,2023-02-02
Li_2022b,"Li M,Park N,Santo VE","Good Meat, Inc.",Extrudate food compositions comprising cultivated animal cells and methods of production thereof,https://patentimages.storage.googleapis.com/ee/e2/41/b41cd20a402f4d/WO2022047263A1.pdf; https://patents.google.com/patent/WO2022047263A1/en?oq=WO2022047263A1,Patent,"Meat,Cultivated",,,,,Provided herein are extruded food products comprising cultivated animal cells and a plant protein. Also provided are methods for preparing extruded food products.,,Cultivated Meat Library,,,2022,3/3/22,WIPO,2022047263:A1,8/27/21,World Patent,World Intellectual Property Organization,PC:T/US2021/048106,2022-08-26,2023-02-02
Lavon_2022d,"Lavon N,Toubia D,Bodanovsky A",Aleph Farms Ltd,Pluripotent cell aggregates and use thereof,https://patentimages.storage.googleapis.com/cf/19/e6/419b0247cea70a/US20220220439A1.pdf; https://patents.google.com/patent/US20220220439A1/en?oq=US20220220439A1,Patent,"Meat,Cultivated",,,,,"The present invention relates to compositions and methods for mass production of pluripotent stem cells derived from non-human-animal, particularly in a form of aggregates suitable for a variety of uses, particularly to mass production of aggregates of bovine-derived pluripotent stem cells for use in cell grown meat cultures and in production of cell based meat products.",,Cultivated Meat Library,,,2022,7/14/22,USPTO,20220220439:A1,5/14/20,US Patent,United States Patent and Trademark Office,US:17/610485,2022-08-26,2023-02-02
Santo_2022,"Santo VE,Nguyen CM,Haque MA,Bignone P",Good Meat Inc,Food products comprising cultivated bovine cells and methods thereof,https://patentimages.storage.googleapis.com/54/76/cb/a01eef6702de48/US20220183316A1.pdf; https://patents.google.com/patent/US20220183316A1/en?oq=US20220183316A1,Patent,"Meat,Cultivated",,,,,Provided herein are bovine cells that are adapted to grow in growth medium that contains low-serum or no serum and methods thereof. Also provided are food products made from bovine cells cultivated in vitro and methods for harvesting the cells.,,Cultivated Meat Library,,,2022,6/16/22,USPTO,20220183316:A1,12/15/21,US Patent,United States Patent and Trademark Office,US:17/551983,2022-08-26,2023-02-02
Johnson_2022a,"Johnson KL,Benton PR,Copeland CG,Dhadwar SS,Firpo MT,Gibbons ME,Hsu SK,Sierra R,Kayser KJ",Upside Foods Inc,Nutrient media for the production of slaughter-free meat,https://patentimages.storage.googleapis.com/8e/c4/32/bf33718d352c69/US20220073870A1.pdf; https://patents.google.com/patent/US20220073870A1/en?oq=US20220073870A1,Patent,"Meat,Cultivated",,,Cell culture media,,"Provided herein are nutrient media formulations and engineered growth factors, and methods thereof, useful for the production of slaughter-free meat.",,Cultivated Meat Library,,,2022,3/10/22,USPTO,20220073870:A1,6/7/21,US Patent,United States Patent and Trademark Office,US:17/341220,2022-08-26,2023-02-02
Wyrwas_2021,"Wyrwas B,Chen IH",Finless Foods Inc.,Systems and methods for live fish tissue preservation,https://patentimages.storage.googleapis.com/75/0c/bf/274923ff23c5fb/WO2021173535A1.pdf; https://patents.google.com/patent/WO2021173535A1/en?oq=WO2021173535A1,Patent,"Meat,Cultivated",,,,,"The present disclosure describes systems, devices, compositions, and methods for live tissue preservation.",,Cultivated Meat Library,,,2021,9/2/21,WIPO,2021173535:A1,2/23/21,World Patent,World Intellectual Property Organization,PC:T/US2021/019210,2022-08-26,2023-02-02
Faram_2021,"Faram R,Bollag B,Emawodia J,Wallis S",HigherSteaks Limited,Systems and methods for cell conversion,https://patentimages.storage.googleapis.com/8b/f7/7b/07da5b362e2b79/WO2021250407A1.pdf; https://patents.google.com/patent/WO2021250407A1/en?oq=WO2021250407A1,Patent,"Meat,Cultivated",,,,,The present disclosure provides methods and systems for the large-scale generation of differentiated stem cells. The present disclosure is also directed to systems and methods for expanding and differentiating stem cells in large-scale culture using a bioreactor chamber.,,Cultivated Meat Library,,,2021,12/16/21,WIPO,2021250407:A1,6/9/21,World Patent,World Intellectual Property Organization,PC:T/GB2021/051437,2022-08-26,2023-02-02
Vila_2021a,"Vila M,Lull T",Biotech Foods S.L.,Process and device for production of cultured meat,https://patentimages.storage.googleapis.com/56/05/ec/cfc41d894d2e23/WO2021250292A1.pdf; https://patents.google.com/patent/WO2021250292A1/en?oq=WO2021250292A1,Patent,"Meat,Cultivated",,,,,"The present invention relates to a process for the production of in vitro engineered tissues, also known in the art as cultured meat, cultivated meat, cell based meat, cellular meat and/or clean meat, and a device for the production of the same. The process comprises the steps of: loading sterilizable 3D scaffolds into a seeding chamber; sterilizing the scaffolds in the seeding chamber; seeding the scaffolds by loading a first volume of culture medium into the seeding chamber, wherein the first volume of culture medium has a density of cells in suspension of 5,000 to 25,000 cell/cm2, more preferably from 10,000 to 16,000 cm2 such that the scaffolds are immersed in the culture medium; leaving the scaffolds and the first volume of culture medium in the seeding chamber for a period of 2-24 hours at 18-37 еЎC; loading a second volume of culture medium into a bioreactor, the second volume being greater than the first volume of the culture medium wherein an incubation position of one or more movable grids inside the bioreactor confines the scaffolds to the second volume of the culture medium such that they remain immersed during an incubation step, wherein the scaffolds and the second volume of culture medium are incubated in the bioreactor for a period of 10-60 days at 18-37 еЎC and at a pH between 6.5-8.0, more preferably 7.0-7.4. The invention also relates to a device for the production of cultured meat.",,Cultivated Meat Library,,,2021,12/16/21,WIPO,2021250292:A1,6/12/20,World Patent,World Intellectual Property Organization,PC:T/ES2020/070387,2022-08-26,2023-02-02
Vila_2021b,"Vila M,Cortizo D",Biotech Foods S.L.,Edible and sterilizable porous 3d scaffold and uses thereof,https://patentimages.storage.googleapis.com/5f/a6/70/1b18606eedb999/WO2021250291A1.pdf; https://patents.google.com/patent/WO2021250291A1/en?oq=WO2021250291A1,Patent,"Meat,Cultivated",,,,,"The present invention relates to edible and sterilizable macroporous three-dimensional (3D) tissue engineering scaffolds comprising a network of cross-linked biocompatible polymer, preferably a natural polymer. Moreover, the scaffold of the invention further comprises additives and living cells which adhere and proliferate, colonizing the entire surface of the scaffold and giving rise to a raw material for the later formation of tissue with a high nutritive content and/or cultured meat, that may be subsequently processed into food for animal or human consumption without requiring modification or removal of the cells from the scaffold. The invention also relates to a method of using the scaffolds to make cultured meat and/or tissues to be processed as food comprising the scaffold.",,Cultivated Meat Library,,,2021,12/16/21,WIPO,2021250291:A1,6/12/20,World Patent,World Intellectual Property Organization,PC:T/ES2020/070386,2022-08-26,2023-02-02
Vila_2021c,"Vila M,Cortizo D",Biotech Foods S.L.,Method for the synthesis of an edible and sterilizable porous 3d scaffold suitable for use in the large-scale production of cultured meat,https://patentimages.storage.googleapis.com/3f/1a/3c/860718ed04ede5/WO2021250290A1.pdf; https://patents.google.com/patent/WO2021250290A1/en?oq=WO2021250290A1,Patent,"Meat,Cultivated",,,,,"The present invention relates to a method for the large-scale synthesis of an edible and hot steam sterilizable macroporous three-dimensional (3D) scaffold which comprises biocompatible polymers with interconnected pores as a support material for adherent cell growth, proliferation and differentiation, which may be used to obtain tissue with nutritive content and/or cultured meat. These scaffolds are suitable for supporting cell tissue growth for biomedical or food applications.",,Cultivated Meat Library,,,2021,12/16/21,WIPO,2021250290:A1,6/12/20,World Patent,World Intellectual Property Organization,PC:T/ES2020/070385,2022-08-26,2023-02-02
Juarez_2021,Juarez MV,Biotech Foods SL,Bioreactor and method for the production of adherent cell cultures employing said bioreactor,https://patentimages.storage.googleapis.com/ad/48/a7/4897e1d37f71a6/EP3907274A1.pdf; https://patents.google.com/patent/EP3907274A1/en?oq=EP3907274A1,Patent,"Meat,Cultivated",,,,,"Bioreactor and production process of adherent cell cultures that uses the bioreactor. The bioreactor (1) comprises a recipient (2) with a cover (3), and further comprises internally a bracket (4) from which protrudes at least one tray (5) that supports a three-dimensional polymer-based element (6) mounted on it, such that when the bioreactor (1) is filled with a culture medium the at least one tray (5) and the three-dimensional polymer-based element (6) are surrounded by the culture medium.The process comprises the following steps:- the bracket (4), with the at least one tray (5) of the bioreactor (1), with a three-dimensional polymer-based element (6) is immersed in the culture medium,- cells that are desired to be planted on the three-dimensional polymer-based element (6) are inoculated from outside the bioreactor (1), and- the culture is left in the bioreactor (1) so that the cellular proliferation is produced.",,Cultivated Meat Library,,,2021,11/10/21,EPO,3907274:A1,1/4/19,European Patent,European Patent Office,EP:19718771.9A,2022-08-26,2023-02-02
Kozlovski_2021,Kozlovski D,"Meatech 3D, Ltd.",Bioprinter print head,https://patentimages.storage.googleapis.com/f6/f8/88/62dbb5f4267071/WO2021178928A3.pdf; https://patents.google.com/patent/WO2021178928A3/en?oq=WO2021178928A3,Patent,"Meat,Cultivated",,,,,"The disclosure relates to print heads for use in the bioprinting of biostructures having predetermined two (2D)- and/or three dimensional (3D) pattern of cells. Specifically, the disclosure relates to print heads operable in a bioprinting systems for the fabrication of edible biostructures using drop-on-demand.",,Cultivated Meat Library,,,2021,10/21/21,WIPO,2021178928:A3,3/5/21,World Patent,World Intellectual Property Organization,PC:T/US2021/021254,2022-08-26,2023-02-02
Fima_2021a,Fima S,"Meatech 3D, Ltd.",Physical manipulation of cultured muscle tissue,https://patentimages.storage.googleapis.com/69/be/a1/8d6c9492511bd1/WO2021055996A1.pdf; https://patents.google.com/patent/WO2021055996A1/en?oq=WO2021055996A1,Patent,"Meat,Cultivated",,,,,"The disclosure relates to methods, systems and compositions for physically manipulating a muscle tissue culture either mechanically, or manually, or both. Specifically, the disclosure relates to systems and methods of physically manipulating, either mechanically or manually, a resilient container of bioprinted tissue culture having non-random three dimensional cell structure by elongation, compression, torque and shear of the tissue culture.",,Cultivated Meat Library,,,2021,3/25/21,WIPO,2021055996:A1,9/22/20,World Patent,World Intellectual Property Organization,PC:T/US2020/052063,2022-08-26,2023-02-02
Fima_2021b,"Fima S,Idan GAL","Meatech 3D, Ltd.",Cultured edible meat fabrication using bio-printing,https://patentimages.storage.googleapis.com/c0/9e/4f/8c165f0061bfa5/WO2021007359A1.pdf; https://patents.google.com/patent/WO2021007359A1/en?oq=WO2021007359A1,Patent,"Meat,Cultivated",,,,,"The disclosure relates to methods, systems and compositions for use in the bio printing of biostructures having predetermined two (2D)- and/or three dimensional (3D) pattern of cells Specifically, the disclosure relates to methods and compositions implementable in a computerized bio-printing systems for the fabrication of edible bio structures using drop-on-demand, having a predetermined three dimensional structure that can be assembled from 2D patterns with cells and extracellular material (ECM) incorporated therein whether in the presence of biocompatible scaffolding or not, in a non-random two- and three dimensional pattern.",,Cultivated Meat Library,,,2021,1/14/21,WIPO,2021007359:A1,7/8/20,World Patent,World Intellectual Property Organization,PC:T/US2020/041265,2022-08-26,2023-02-02
Ling_2021,"Ling KY,Sriram S",Shiok Meats Pte Ltd,Isolation and cultivation of muscle and fat cells from crustaceans,https://patentimages.storage.googleapis.com/74/06/59/016123720f7ec8/AU2020209356A1.pdf; https://patents.google.com/patent/AU2020209356A1/en?oq=AU2020209356A1,Patent,"Meat,Cultivated",,,,,"The present disclosure is directed to methods for the formation and production of renewable muscle and/or fat primary cell lines, immortalized cell lines, and stem cell lines from shrimp, prawn, crab, crayfish, and/or lobster species and the cell lines themselves as well as human and animal consumable meat products produced therefrom.",,Cultivated Meat Library,,,2021,9/9/21,,AU:2020209356:A1,1/13/20,Patent,,AU:2020209356A,2022-08-26,2023-02-02
