Chin_2021b,"Chin PS,Chan KY,Poon CH",Avant Meats Co Ltd,Cell hydrolysate composition from cultivated cells and applications thereof,https://patentimages.storage.googleapis.com/20/f0/a1/a1846bc139ea7a/US20210246480A1.pdf; https://patents.google.com/patent/US20210246480A1/en?oq=US20210246480A1,Patent,"Meat,Cultivated",,,,,"A cell hydrolysate composition, the composition comprising substantially all protein polypeptides and/or polypeptide fragments derived substantially from all the proteins in a cell from an in vitro cell culture.",,Cultivated Meat Library,,,2021,8/12/21,USPTO,20210246480:A1,4/28/21,US Patent,United States Patent and Trademark Office,US:17/243493,2022-08-26,2023-02-02
Chin_2021a,"Chin PS,Chan KY,Li CW",Avant Meats Company Limited,"System for producing cultivated meats, tissues and associated products from cells",https://patentimages.storage.googleapis.com/3c/41/01/f98c4a431b71b5/WO2021111270A1.pdf; https://patents.google.com/patent/WO2021111270A1/en?oq=WO2021111270A1,Patent,"Meat,Cultivated",,,,,A cell culture system that enhances cell production and reduces the cost of growing cell culture. The system maintains an optimal culture condition by stabilizing the level of nutrients and/or maintaining a minimum level of growth inhibitors in a culture medium. The system comprises a cell culture unit configured to hold at least one type of cell; a fresh medium unit configured to supply and receive the first fluid to the cell culture unit; a waste removal unit configured to supply and receive a second fluid from the fresh medium unit; and a dialysis unit configured to extract the waste from the first fluid to the second fluid and supply nutrient from the second fluid to the first fluid.,,Cultivated Meat Library,,,2021,6/10/21,WIPO,2021111270:A1,11/30/20,World Patent,World Intellectual Property Organization,PC:T/IB2020/061257,2022-08-26,2023-02-02
네타 라본_2021,"네타 라본,일로나 코렌",,"High-quality cultured meat, composition and method for producing same",https://patentimages.storage.googleapis.com/cc/5e/b8/92e708710080ed/KR20210090632A.pdf; https://patents.google.com/patent/KR20210090632A/en?oq=KR20210090632A,Patent,"Meat,Cultivated",,,,,"The present invention relates to the field of cultured meat, also called clean meat or cell-based meat, in particular to a cell culture for producing cultured meat having sensory properties (color, taste and aroma) at least similar to whole animal-derived meat and improved nutritional value. The present invention also provides a cell culture and a culture medium for producing high-quality cultured meat.",,Cultivated Meat Library,,,2021,7/20/21,,KR:20210090632:A,11/14/19,Patent,,KR:1020217014540A,2022-08-26,2023-02-02
Bodanovsky_2021,"Bodanovsky A,Lavon N,Toubia D",Aleph Farms Ltd,Pluripotent cell aggregates and use thereof,https://patentimages.storage.googleapis.com/b3/2e/a8/115bc9c62ad83c/AU2020273728A1.pdf; https://patents.google.com/patent/AU2020273728A1/en?oq=AU2020273728A1,Patent,"Meat,Cultivated",,,,,"The present invention relates to compositions and methods for mass production of pluripotent stem cells derived from non-human-animal, particularly in a form of aggregates suitable for a variety of uses, particularly to mass production of aggregates of bovine-derived pluripotent stem cells for use in cell grown meat cultures and in production of cell based meat products.",,Cultivated Meat Library,,,2021,11/18/21,,AU:2020273728:A1,5/14/20,Patent,,AU:2020273728A,2022-08-26,2023-02-02
Verstrate_2021,Verstrate P,Mosa Meat B.V.,Packaging of cultured tissue,https://patentimages.storage.googleapis.com/95/35/5d/10d29e4e8fc39f/WO2021158104A1.pdf; https://patents.google.com/patent/WO2021158104A1/en?oq=WO2021158104A1,Patent,"Meat,Cultivated",,,,,"The invention is in the field of cultured meat. In particular the invention is related to a method for aseptic packaging of cultured tissue and a system suitable for this method. The method comprises the steps of producing the cultured tissue, harvesting the cultured tissue, transferring the cultured tissue to a sterile package and sealing the sterile package, wherein all steps are executed under aseptic conditions.",,Cultivated Meat Library,,,2021,8/12/21,WIPO,2021158104:A1,2/3/21,World Patent,World Intellectual Property Organization,PC:T/NL2021/050067,2022-08-26,2023-02-02
Moutsatsou_2021,"Moutsatsou P,Cruz H,Klevernic I,Kolkmann A,Van Essen A",Mosa Meat B.V.,Serum-free medium for culturing a bovine progenitor cell,https://patentimages.storage.googleapis.com/10/2d/5b/e1ddc6bf916e15/WO2021158103A1.pdf; https://patents.google.com/patent/WO2021158103A1/en?oq=WO2021158103A1,Patent,"Meat,Cultivated",,,,,"A method for culturing a bovine progenitor cell, comprising the step of: culturing a bovine progenitor cell in a serum-free medium for culturing a bovine progenitor cell, wherein said serum-free medium comprises - an albumin; and - a fibroblast growth factor (FGF).",,Cultivated Meat Library,,,2021,8/12/21,WIPO,2021158103:A1,2/3/21,World Patent,World Intellectual Property Organization,PC:T/NL2021/050066,2022-08-26,2023-02-02
Genovese_2021,Genovese NJ,"Memphis Meats, Inc.",Use of tead proteins for production of cellular biomass,https://patentimages.storage.googleapis.com/3b/15/a5/accbc3842465f5/WO2021092587A1.pdf; https://patents.google.com/patent/WO2021092587A1/en?oq=WO2021092587A1,Patent,"Meat,Cultivated",,,,,"Provided herein are methods to increase the culture density and/or thickness of a cellular biomass in a cultivation infrastructure, and to promote anchorage-independent growth of a cellular biomass in a cultivation infrastructure. The methods comprise activating a TEAD protein, for example, by increasing cellular expression of the TEAD protein or by increasing cellular expression of a fusion protein comprising a DNA-binding domain (DBD) derived from a TEAD protein and a transcriptional activation domain (TAD) in the cellular biomass. In some embodiments, the cellular biomass is harvested from the cultivation infrastructure for the formulation of cell-grown food products or ingredients, such as animal meat manufactured from cells in an ex vivo process or for therapeutic applications such as organ or tissue transplantation or grafting.",,Cultivated Meat Library,,,2021,5/14/21,WIPO,2021092587:A1,11/9/20,World Patent,World Intellectual Property Organization,PC:T/US2020/059744,2022-08-26,2023-02-02
Kayser_2021,"Kayser KJ,Rease ML,Juhas ME,Joslin JM,Valeti US,Schulze EN",Upside Foods Inc,Characteristics of meat products,https://patentimages.storage.googleapis.com/2f/cc/9f/d95e9db337df20/US20210235733A1.pdf; https://patents.google.com/patent/US20210235733A1/en?oq=US20210235733A1,Patent,"Meat,Cultivated",,,,,"The present disclosure provides methods and compositions useful for the production of slaughter-free meat products, and the characterizations of the same. The slaughter-free meat products contain several points of distinction when compared to conventional meat procured by harvesting the tissue of a dead animal. Such points of distinction include, but are not limited to, significantly reduced or substantially no: steroid hormones, antibiotics, or microbial contamination; lower fat content; no vasculature; and extended shelf life both at room temperature and when refrigerated.",,Cultivated Meat Library,,,2021,8/5/21,USPTO,20210235733:A1,9/25/20,US Patent,United States Patent and Trademark Office,US:17/033635,2022-08-26,2023-02-02
Leung_2020,"Leung M,Godbole A,Engelmayr Jr GC,Genovese NJ,Valeti US,Carswell K","Memphis Meats, Inc.",Apparatuses and methods for preparing a comestible meat product,https://patentimages.storage.googleapis.com/15/5a/ec/588629b55f739f/WO2020243324A1.pdf; https://patents.google.com/patent/WO2020243324A1/en?oq=WO2020243324A1,Patent,"Meat,Cultivated",,,,,"The substrates, systems, and methods described herein relate to textured substrates for preparing a comestible meat product. Substrates and methods are described herein for controlling one or more of growth, adhesion, retention, and/or release of cells (e.g., of a cell sheet) on or from the surface of the substrate. A method of preparing a comestible meat product may include applying a plurality of non-human cells to at least one patterned texture substrate, growing the cells on the patterned texture substrate to form the comestible meat product, and separating the comestible meat product from the patterned texture substrate. The patterned texture allows for improved growth, adhesion, retention, and/or release of cells as compared to another surface not comprising the patterned texture. In some embodiments, the cell culture substrate surfaces include a plurality of regions corresponding to a plurality of patterned textures.",,Cultivated Meat Library,,,2020,12/3/20,WIPO,2020243324:A1,5/28/20,World Patent,World Intellectual Property Organization,PC:T/US2020/034949,2022-08-26,2023-02-02
Leung_2021,"Leung M,Warner M,Vanderpol RE,Hsiu TP,Carswell K",Upside Foods Inc,Apparatuses and systems for preparing a meat product,https://patentimages.storage.googleapis.com/c6/15/58/777278adacac36/US11147300.pdf; https://patents.google.com/patent/US11147300B2/en?oq=US11147300B2,Patent,"Meat,Cultivated",,,,,"The apparatuses described herein relate to preparation of a meat product. Apparatuses, systems comprising the apparatuses, and methods of making and use the systems and apparatuses are described herein. These are useful for controlling one or more of growth on and separation of a meat product from an enclosed substrate. The apparatuses and systems are configured to receive fluid and grow the meat product and/or separate the meat product from the substrate in a scalable manner.",,Cultivated Meat Library,,,2021,10/19/21,USPTO,11147300,11/20/20,US Patent,United States Patent and Trademark Office,US:17/100705,2022-08-26,2023-02-02
Elfenbein_2020b,"Elfenbein A,Kolbeck JL,Larson B","Wild Type, Inc.",Synthetic food compositions,https://patentimages.storage.googleapis.com/bb/d4/78/be1b34e8fb7bd3/WO2020123876A1.pdf; https://patents.google.com/patent/WO2020123876A1/en?oq=WO2020123876A1,Patent,"Cultivated,Seafood",,,,,"Systems and methods for producing food products including cultured food products. The cultured food products include sushi-grade fish meat, fish surimi, foie gras, and other food types. Various cell types are utilized to produce the food products and can include muscle, fat, and/or liver cells. The cultured food products are grown in pathogen-free culture conditions without exposure to toxins and other undesirable chemicals. The food products can be processed to provide a desired shape, texture and consistency.",,Cultivated Meat Library,,,2020,6/18/20,WIPO,2020123876:A1,12/12/19,World Patent,World Intellectual Property Organization,PC:T/US2019/066089,2022-08-26,2023-02-02
Lavon_2020,"Lavon N,Aviv M,Roth Y,Toubia D",Aleph Farms Ltd.,Cultivation systems and methods for large-scale production of cultured food,https://patentimages.storage.googleapis.com/c2/1a/78/543a80fdef50be/WO2020222239A1.pdf; https://patents.google.com/patent/WO2020222239A1/en?oq=WO2020222239A1,Patent,"Meat,Cultivated",,,,,"Systems and methods for producing cultured food products such as cultured meat in a form of meat cut or offal are provided, comprising growing non-human-animal adherent cells on edible scaffold(s) in a cultivation system. The cultivation system typically comprises a plurality of cell culture bioreactors receiving medium at a controlled flow rate adjusted to nourish the non-human-animal adherent cells.",,Cultivated Meat Library,,,2020,11/5/20,WIPO,2020222239:A1,4/30/20,World Patent,World Intellectual Property Organization,PC:T/IL2020/050484,2022-08-26,2023-02-02
Mullen_2020,"Mullen N,Park N,Jones C,Bowman T,Bignone P,Santo VE,Kambam P,Haque A,Amadi IM",Just Inc,In vitro avian food product,https://patentimages.storage.googleapis.com/11/77/19/188bb4cda2638f/US20200392461A1.pdf; https://patents.google.com/patent/US20200392461A1/en?oq=US20200392461A1,Patent,"Meat,Cultivated",,,,,"Provided herein are food products made in vitro from avian fibroblast cells and methods for harvesting the avian fibroblast cells. Particularly, an in vitro produced chicken product is produced. Also provided herein are methods of their production.",,Cultivated Meat Library,,,2020,12/17/20,USPTO,20200392461:A1,6/12/20,US Patent,United States Patent and Trademark Office,US:16/900719,2022-08-26,2023-02-02
Forgacs_2017,"Forgacs G,Marga FS,Norotte C",University of Missouri System,Self-assembling multicellular bodies and methods of producing a three-dimensional biological structure using the same,https://patentimages.storage.googleapis.com/fa/7a/2a/e8467234865c8a/US20170152474A1.pdf; https://patents.google.com/patent/US20170152474A1/en?oq=US20170152474A1,Patent,"Meat,Cultivated",,,,,"Structures and methods for tissue engineering include a multicellular body including a plurality of living cells. A plurality of multicellular bodies can be arranged in a pattern and allowed to fuse to form an engineered tissue. The arrangement can include filler bodies including a biocompatible material that resists migration and ingrowth of cells from the multicellular bodies and that is resistant to adherence of cells to it. Three-dimensional constructs can be assembled by printing or otherwise stacking the multicellular bodies and filler bodies such that there is direct contact between adjoining multicellular bodies, suitably along a contact area that has a substantial length. The direct contact between the multicellular bodies promotes efficient and reliable fusion. The increased contact area between adjoining multicellular bodies also promotes efficient and reliable fusion. Methods of producing multicellular bodies having characteristics that facilitate assembly of the three-dimensional constructs are also provided.",,Cultivated Meat Library,,,2017,6/1/17,USPTO,20170152474:A1,1/18/17,US Patent,United States Patent and Trademark Office,US:15/409034,2022-08-26,2023-02-02
Forgacs_2013,"Forgacs G,Marga F,Jakab KR",University of Missouri System,Engineered comestible meat,https://patentimages.storage.googleapis.com/06/a6/8f/3667fe5281696e/US20130029008A1.pdf; https://patents.google.com/patent/US20130029008A1/en?oq=US20130029008A1,Patent,"Meat,Cultivated",,,,,"Provided are engineered meat products formed as a plurality of at least partially fused layers, wherein each layer comprises at least partially fused multicellular bodies comprising non-human myocytes and wherein the engineered meat is comestible. Also provided are multicellular bodies comprising a plurality of non-human myocytes that are adhered and/or cohered to one another; wherein the multicellular bodies are arranged adjacently on a nutrient-permeable support substrate and maintained in culture to allow the multicellular bodies to at least partially fuse to form a substantially planar layer for use in formation of engineered meat. Further described herein are methods of forming engineered meat utilizing said layers.",,Cultivated Meat Library,,,2013,1/31/13,USPTO,20130029008:A1,7/26/12,US Patent,United States Patent and Trademark Office,US:13/558928,2022-08-26,2023-02-02
Engelmayr_2021,"Engelmayr, G.C., Fischer, I.E., Bergeron, A., Shahrokhi, S., Paton, W.C., Maciag, V., Radstrom, X.G., Beville, A., Yaman, R.","Mission Barns, Inc",Scalable bioreactor systems and related methods of use,https://patentimages.storage.googleapis.com/94/cc/a1/f1cec81d1f11a3/WO2021207293A1.pdf,Patent,"Meat,Cultivated",,,,,Bioreactors configured to scale-up the production of greater quantities of cells at relatively low cost are provided. These bioreactors may be utilized in the production of large-scale quantities of cell-based meat and cell-based fat. The bioreactors may be reusable and may have a high surface area-to-volume ratio for adherent cell expansion. The bioreactors may be capable of yielding a large number of adherent cells per bioreactor unit.,,Cultivated Meat Library,,,2021,10/14/21,WIPO,2021207293A1,4/6/21,World Patent,World Intellectual Property Organization,,2022-08-26,2023-02-02
Leung_2022,"Leung M,Benton PR,Copeland CG,Hsu SK,Johnson KL",Upside Foods Inc,"Systems, devices, and methods for sterilizing bioreactors and culture media",https://patentimages.storage.googleapis.com/02/73/4b/266750ada0eeba/US20220056394A1.pdf; https://patents.google.com/patent/US20220056394A1/en,Patent,"Meat,Cultivated",,,,,"Disclosed herein are systems, devices, and methods for sterilization. In some variations, a method of sterilizing a bioreactor system may comprise circulating a sterilant in a bioreactor and an enclosed vessel in fluidic communication with the bioreactor. The enclosed vessel may comprise cell culture media. The sterilant may be circulated for a dwell time sufficient to sterilize at least one of the bioreactor, the vessel, and the cell culture media.",,Cultivated Meat Library,,,2022,2/24/22,USPTO,20220056394:A1,8/18/20,US Patent,United States Patent and Trademark Office,US:16/996567,2022-08-26,2023-02-02
Teglia_2022,"Teglia L,Sharma VL,Handlin Jr DL,Kleiman I,Varadaraju H",Modern Meadow Inc,Layered collagen materials and methods of making the same,https://patentimages.storage.googleapis.com/dc/bc/a9/c6f73ae3c03414/US20220153993A1.pdf; https://patents.google.com/patent/US20220153993A1/en?oq=US20220153993A1,Patent,"Meat,Cultivated",,,,,"The present disclosure provides layered collagen materials comprising one or more collagen/polymer matrix layers. The collagen/polymer matrix layer(s) are formed of a collagen blended with one or more polymers. The collagen blended within the polymer(s) can be dissolved within the polymer(s). The one or more collagen/polymer matrix layers can be attached to a substrate layer, for example a fabric layer.",,Cultivated Meat Library,,,2022,5/19/22,USPTO,20220153993:A1,1/31/22,US Patent,United States Patent and Trademark Office,US:17/589038,2022-08-26,2023-02-02
川島 一公_2021,"川島 一公,羽生 雄毅",インテグリカルチャー株式会社,Cell culture management system,https://patentimages.storage.googleapis.com/56/e3/8a/b4aeda22dc6ba4/WO2021161397A1.pdf; https://patents.google.com/patent/WO2021161397A1/en?oq=WO2021161397A1,Patent,"Meat,Cultivated",,,,,"The present invention provides a cell culture management system. The cell culture management system of the present invention comprises: an output data server provided for a first culture device for culturing a first cell; a customer server provided for a second culture device for culturing a second cell; and a cell management server provided for a cell management repository storing the second cell, wherein the output data server, the customer server, and the cell management server are individually connected to a data management device in such a manner as to allow data transmission and reception therebetween.",,Cultivated Meat Library,,,2021,2021-08-19,WIPO,2021161397:A1,2020-02-10,World Patent,World Intellectual Property Organization,PC:T/JP2020/005189,2022-08-31,2023-02-02
川岛一公_2021,"川岛一公,羽生雄毅,福本景太",Integriculture Inc,"Animal cell growth promoter, medium for animal cell culture, and animal cell culture device",https://patentimages.storage.googleapis.com/76/1e/06/f43afeadd94a31/CN113015789A.pdf; https://patents.google.com/patent/CN113015789A/en?oq=CN113015789A,Patent,"Meat,Cultivated",,,,,"The object of the present invention is to provide a novel animal cell growth promoter. Specifically, a culture supernatant of an embryonic membrane of an egg of an avian or reptile is used as an animal cell proliferation promoter. For example, the proliferation of animal cells can be promoted by adding a cell proliferation agent containing, as an active ingredient, a culture supernatant of an embryonic membrane of an egg of birds or reptiles to a culture medium for animal cell culture.",,Cultivated Meat Library,,,2021,2021-06-22,,CN:113015789:A,2019-11-07,Patent,,CN:201980074375.3A,2022-08-31,2023-02-02
Nahmias_2021b,"Nahmias Y,Wissotsky G",Yissum Research Development Company Of The Hebrew University Of Jerusalem Ltd.,Methods and devices for filtering cell culture media,https://patentimages.storage.googleapis.com/1b/88/13/b0a3c72861d82b/WO2021152536A1.pdf; https://patents.google.com/patent/WO2021152536A1/en,Patent,"Cultivated,Meat",,,Bioprocess design,,"The present disclosure provides, in part, a receptacle for filtering a liquid. The receptacle comprises a plurality of hollow fibers extending the length of the receptacle and at least one solid absorbent material occupying a space between the plurality of hollow fibers. Each hollow fiber comprises at least one opening and a lumen defined by the walls thereof, allowing the liquid to flow through. The hollow fiber walls have a porosity profile selective to passage of waste materials contained in the liquid from the lumen to the solid absorbent material(s), thereby filtering the liquid. Also provided is a system as well as a method for filtering and recycling a cell culture medium.",,Cultivated Meat Library,,,2021,2021-08-05,WIPO,2021152536:A1,2021-01-29,World Patent,World Intellectual Property Organization,PC:T/IB2021/050728,2023-01-12,2023-01-13
Khademhosseini_2022,"Khademhosseini A,Hosseini SV,Zamanian B",,Constructs for meat cultivation and other applications,https://app.dimensions.ai/downloads/patents?ucid=WO-2022192426-A1,Patent,"Cultivated,Meat",,,Scaffolding,,,,Cultivated Meat Library,,,2022,,WIPO,2022/192426 A1,2022-03-09,World Patent,World Intellectual Property Organization,,2023-01-12,2023-04-18
Nahmias_2021a,"Nahmias Y,Cohen M,Caspi J",Yissum Research Development Company Of The Hebrew University Of Jerusalem Ltd.,Utilization of plant protein homologues in culture media,https://patentimages.storage.googleapis.com/9e/f1/2e/7f8acd3f8f5b0b/WO2021148955A1.pdf; https://patents.google.com/patent/WO2021148955A1/en,Patent,"Cultivated,Meat",,,Cell culture media,,"The present disclosure provides, in part, a cell culture medium supplement comprising at least one plant protein homologue of a serum protein, a cell culture medium comprising a serum-free base medium and one or more plant based proteins, and methods of growing cells in vitro and of producing cultured meat using the cell culture medium.",,Cultivated Meat Library,,,2021,2021-07-29,WIPO,2021148955:A1,2021-01-20,World Patent,World Intellectual Property Organization,PC:T/IB2021/050413,2023-01-12,2023-01-13